{
  "dataset": "d365-finops-pqu",
  "schema_version": "1.1.0",
  "generated_at": "2026-10-13T13:44:17.669863Z",
  "source": {
    "publisher": "Microsoft",
    "repository": "MicrosoftDocs/dynamics-365-unified-operations-public",
    "branch": "main",
    "file_path": "articles/fin-ops-core/dev-itpro/get-started/quality-updates-schedule.md",
    "commit": "7d86a35169692606d303c21e204ae6032d44d44e",
    "article_url": "https://learn.microsoft.com/en-us/dynamics365/fin-ops-core/dev-itpro/get-started/quality-updates-schedule",
    "raw_url": "https://raw.githubusercontent.com/MicrosoftDocs/dynamics-365-unified-operations-public/7d86a35169692606d303c21e204ae6032d44d44e/articles/fin-ops-core/dev-itpro/get-started/quality-updates-schedule.md",
    "markdown_date": "2026-10-13",
    "sha256": "8431bf5fb97becf088a0eaa4eec8f42cb7f86dcafc7f68f9d4b3d972b5cf1eb0",
    "retrieved_at": "2026-10-13T13:44:17.669863Z"
  },
  "license": {
    "name": "Creative Commons Attribution 4.0 International",
    "url": "https://creativecommons.org/licenses/by/4.0/",
    "attribution": "Text from Microsoft Learn documentation by Microsoft, published in MicrosoftDocs/dynamics-365-unified-operations-public.",
    "changes": "Converted to structured text; images, includes, embedded HTML, and tables that are published as datasets were removed; links were resolved to Microsoft Learn URLs."
  },
  "count": 5,
  "articles": [
    {
      "key": "schedule",
      "title": "Release schedule for proactive quality updates",
      "url": "https://learn.microsoft.com/en-us/dynamics365/fin-ops-core/dev-itpro/get-started/quality-updates-schedule",
      "sections": [
        {
          "id": "intro",
          "anchor": null,
          "aliases": [],
          "title": "Release schedule for proactive quality updates",
          "level": 1,
          "url": "https://learn.microsoft.com/en-us/dynamics365/fin-ops-core/dev-itpro/get-started/quality-updates-schedule",
          "text_sha256": "8b042c7500c7d2c4115c48aefb25ab1fff10348d93ba8b3edbc7d6f7eebd7149",
          "blocks": [
            {
              "type": "paragraph",
              "runs": [
                {
                  "text": "This article provides the release schedule for proactive quality updates (PQUs)."
                }
              ]
            },
            {
              "type": "paragraph",
              "runs": [
                {
                  "text": "The detailed schedule for each PQU train and its corresponding build app version number is published five days before the start of the PQU train. Five days before the start of release train, Microsoft sends a notification to customers who use the environments that receive the update."
                }
              ]
            },
            {
              "type": "paragraph",
              "runs": [
                {
                  "text": "Station 1 is the first release station. It consists of customers who opt in to have their sandbox environments receive the update before all other stations. More details are published after this functionality is made generally available in May 2023."
                }
              ]
            },
            {
              "type": "paragraph",
              "runs": [
                {
                  "text": "To determine when your Microsoft Dynamics Lifecycle Service environment is updated, find the region and the station-to-region mapping. Cross-reference the region and station-to-region mapping information with the upcoming PQU train for a service update."
                }
              ]
            },
            {
              "type": "paragraph",
              "runs": [
                {
                  "text": "For information about the maintenance windows for each region, see "
                },
                {
                  "text": "What are the planned maintenance windows by region?",
                  "href": "https://learn.microsoft.com/en-us/dynamics365/fin-ops-core/dev-itpro/deployment/plannedmaintenance-selfservice#windows"
                }
              ]
            }
          ]
        },
        {
          "id": "station-to-region-mapping",
          "anchor": "station-to-region-mapping",
          "aliases": [],
          "title": "Station-to-region mapping",
          "level": 2,
          "url": "https://learn.microsoft.com/en-us/dynamics365/fin-ops-core/dev-itpro/get-started/quality-updates-schedule#station-to-region-mapping",
          "text_sha256": "15ed46262db1fd83d9ad49fbf319f14ae50ae2b7ff779a0f1ec401803d5bfe58",
          "blocks": [
            {
              "type": "dataset",
              "name": "regions"
            },
            {
              "type": "callout",
              "kind": "important",
              "blocks": [
                {
                  "type": "list",
                  "ordered": true,
                  "items": [
                    [
                      {
                        "type": "paragraph",
                        "runs": [
                          {
                            "text": "The PQU build for every train is typically published to Lifecycle Services after the change cutoff date that shows in the following high-level PQU train schedule. In this way, customers can download and self-apply the build as needed, to frontload any testing requirements."
                          }
                        ]
                      }
                    ],
                    [
                      {
                        "type": "paragraph",
                        "runs": [
                          {
                            "text": "Standard performance test (tier-4) sandbox environments, Premium performance test (tier-5) sandbox environments, and production environments receive PQUs on weekends. If a PQU of production environment, Standard performance test (tier4) sandbox, or Premium performance test (tier5) sandbox didn't complete on the scheduled weekend then the operation gets rescheduled to the next weekend."
                          }
                        ]
                      }
                    ],
                    [
                      {
                        "type": "paragraph",
                        "runs": [
                          {
                            "text": "Standard performance test (tier-4) sandbox environments, Premium performance test (tier-5) sandbox environments opted-in for the First release program (station 1) receive updates on the following weekend of the station 1 schedule."
                          }
                        ]
                      }
                    ]
                  ]
                }
              ]
            }
          ]
        },
        {
          "id": "high-level-pqu-train-schedule",
          "anchor": "high-level-pqu-train-schedule",
          "aliases": [],
          "title": "High-level PQU train schedule",
          "level": 2,
          "url": "https://learn.microsoft.com/en-us/dynamics365/fin-ops-core/dev-itpro/get-started/quality-updates-schedule#high-level-pqu-train-schedule",
          "text_sha256": "f69d121898431056a5c424d33067fc9fd8e2b131b64325223ad6a3a34fbb24df",
          "blocks": [
            {
              "type": "paragraph",
              "runs": [
                {
                  "text": "The following table shows the high-level train schedule. It includes a description of the service update that pertains to the train, the cutoff date after which new changes are no longer accepted, and the development duration for the PQU train."
                }
              ]
            },
            {
              "type": "dataset",
              "name": "trains"
            },
            {
              "type": "callout",
              "kind": "note",
              "blocks": [
                {
                  "type": "paragraph",
                  "runs": [
                    {
                      "text": "Any new finance and operations apps environment that is provisioned after August 17th, 2023 is automatically signed up to receive PQUs per the schedule as applicable. Canceled* - PQU will occur only on Station-1. Releases for other stations have been canceled due to the holiday deployment freeze, and the build will be available for manual uptake. For environments configured with a weekday update schedule, updates are applied on the selected weekday following the published rollout schedule."
                    }
                  ]
                }
              ]
            }
          ]
        },
        {
          "id": "schedule",
          "anchor": "schedule",
          "aliases": [],
          "title": "Detailed station schedules",
          "level": 3,
          "url": "https://learn.microsoft.com/en-us/dynamics365/fin-ops-core/dev-itpro/get-started/quality-updates-schedule#schedule",
          "text_sha256": "662be673a631566194da5e33bd5fdfd0ee7b898b5205d40204b13a8979d8e4de",
          "blocks": [
            {
              "type": "dataset",
              "name": "stations"
            },
            {
              "type": "callout",
              "kind": "important",
              "blocks": [
                {
                  "type": "paragraph",
                  "runs": [
                    {
                      "text": "At least five days in advance, Microsoft updates the preceding schedule and send a notification for the set of environments that are scheduled to receive these quality updates. The preceding schedule is applicable only to environments that are notified about an upcoming update. For information on the dark hours for each region, see "
                    },
                    {
                      "text": "What are the planned maintenance windows by region?",
                      "href": "https://learn.microsoft.com/en-us/dynamics365/fin-ops-core/dev-itpro/deployment/plannedmaintenance-selfservice#windows"